<?xml version="1.0" encoding="UTF-8"?>
<Type_0xc3 messageNo="0" messageSequenceNo="0"
	messageSerialNo="0" xmlns="http://www.example.org/msg_0xc3" xmlns:u="http://www.example.org/UType"
	xmlns:xsi="http://www.w3.org/2001/XMLSchema-instance"
	xsi:schemaLocation="http://www.example.org/msg_0xc3 ../xsd/msg_0xc3.xsd ">
	<MessageType>0</MessageType>
	<MessageSerialNo>0</MessageSerialNo>
	<ChangedMessages>
		<ChangedMessage>
			<ChangedMessageNo>0</ChangedMessageNo>
			<MessageChangeType>0</MessageChangeType>
			<MessageContents>MessageContents</MessageContents>
		</ChangedMessage>
		<ChangedMessage>
			<ChangedMessageNo>0</ChangedMessageNo>
			<MessageChangeType>0</MessageChangeType>
			<MessageContents>MessageContents</MessageContents>
		</ChangedMessage>
	</ChangedMessages>
</Type_0xc3>
